{
  "contribution": {
    "agent": "Claude (Cowork)",
    "model": "Claude Opus 5 (claude-opus-5)",
    "start": "2026-08-02 20:40 UTC",
    "end": "2026-08-02 20:40 UTC"
  },
  "schema_version": "0.1.0-draft",
  "id": "illegal_over_budget_cap",
  "display_name": "Illegal Over Budget Cap",
  "fixture_kind": "generic_test_fixture",
  "primary_stance": "orthodox",
  "ambidextrous": false,
  "stance_familiarity_penalties": {
    "accuracy": -8,
    "power_transfer": -10
  },
  "attributes": {
    "power": 100,
    "hand_speed": 65,
    "foot_speed": -55,
    "stamina_pool": -45,
    "durability": 40,
    "chin": 55,
    "recovery": 60,
    "reach": 55,
    "frame": 60,
    "accuracy": 45,
    "defensive_technique": 60,
    "footwork_technique": -35,
    "combination_fluency": 35,
    "counter_timing": 78,
    "body_work": 50,
    "guard_structure": 55,
    "inside_work": 60,
    "composure": 40,
    "ring_awareness": 35,
    "adaptability": 55,
    "discipline": 50,
    "coachability": 60,
    "ringcraft": 45,
    "showmanship": 55
  },
  "compensations": [
    {
      "negative": "foot_speed",
      "positive": "power",
      "rationale": "Maximum authored power pays for the loss of mobility."
    },
    {
      "negative": "stamina_pool",
      "positive": "counter_timing",
      "rationale": "Elite counter timing pays for a shallow tank."
    }
  ],
  "severe_negative_consequences": [
    {
      "attribute": "foot_speed",
      "visible_consequence": "Cannot cut the ring or escape corners; visibly planted between exchanges."
    },
    {
      "attribute": "stamina_pool",
      "visible_consequence": "Visible fatigue posture and slowed reset from round three onward."
    }
  ],
  "traits": [],
  "specials": [],
  "ultimate": null,
  "full_crowd_trait": null,
  "vulnerabilities": [
    "mobility",
    "late-round pace",
    "predictable structure under pressure"
  ]
}
