{
  "contribution": {
    "agent": "Claude (Cowork)",
    "model": "Claude Opus 5 (claude-opus-5)",
    "start": "2026-08-02 19:34 UTC",
    "end": "2026-08-02 19:34 UTC"
  },
  "schema_version": "0.1.0-draft",
  "id": "legal_baseline",
  "display_name": "Legal Baseline",
  "fixture_kind": "generic_test_fixture",
  "primary_stance": "orthodox",
  "ambidextrous": false,
  "stance_familiarity_penalties": {
    "accuracy": -8,
    "power_transfer": -10
  },
  "attributes": {
    "power": 20,
    "hand_speed": 10,
    "foot_speed": 0,
    "stamina_pool": 15,
    "durability": 5,
    "chin": 0,
    "recovery": 0,
    "accuracy": 25,
    "defensive_technique": 10,
    "footwork_technique": 5,
    "composure": 10,
    "ringcraft": 0
  },
  "compensations": [],
  "severe_negative_consequences": [],
  "traits": [],
  "specials": [],
  "ultimate": null,
  "full_crowd_trait": null,
  "vulnerabilities": []
}
