{
  "contribution": {
    "agent": "Claude (Cowork)",
    "model": "Claude Opus 5 (claude-opus-5)",
    "start": "2026-08-02 19:34 UTC",
    "end": "2026-08-02 19:34 UTC"
  },
  "schema_version": "0.1.0-draft",
  "id": "legal_boundaries",
  "display_name": "Legal Boundaries",
  "fixture_kind": "generic_test_fixture",
  "primary_stance": "orthodox",
  "ambidextrous": false,
  "stance_familiarity_penalties": {
    "accuracy": -8,
    "power_transfer": -10
  },
  "attributes": {
    "power": 70,
    "accuracy": 70,
    "hand_speed": -30,
    "foot_speed": -40,
    "defensive_technique": 5,
    "composure": 0,
    "chin": 10
  },
  "compensations": [],
  "severe_negative_consequences": [],
  "traits": [],
  "specials": [],
  "ultimate": null,
  "full_crowd_trait": null,
  "vulnerabilities": []
}
